{
  "pack_version": "1.0.0",
  "base_contracts_version": "1.0.0-features-003-008",
  "schema_spec_version": "draft/2020-12",
  "created_at": "2026-03-28T00:00:00Z",
  "changelog": [
    {
      "version": "1.0.0",
      "date": "2026-03-28",
      "changes": [
        "Initial schema pack creation",
        "17 artifact contracts converted to JSON Schema",
        "Unified registry with 6-role organization",
        "Basic validation utility provided"
      ]
    }
  ]
}